<?xml version="1.0"?>
<!--

    Serialized - PHP Library for Serialized Data
     
    Copyright (C) 2010-2011 Tom Klingenberg, some rights reserved
     
    This program is free software: you can redistribute it and/or modify
    it under the terms of the GNU Affero General Public License as
    published by the Free Software Foundation, either version 3 of the
    License, or (at your option) any later version.
     
    This program is distributed in the hope that it will be useful,
    but WITHOUT ANY WARRANTY; without even the implied warranty of
    MERCHANTABILITY or FITNESS FOR A PARTICULAR PURPOSE.  See the
    GNU Affero General Public License for more details.
     
    You should have received a copy of the GNU Affero General Public License
    along with this program in a file called COPYING. If not, see
    <http://www.gnu.org/licenses/> and please report back to the original
    author.
    
 	============

    This is a XML dump of a more complex serialized array created
    with Serialized and the XML Dumper.
    
    See serialized.dtd
    
-->
<!DOCTYPE serialized SYSTEM "serialized.dtd">
<serialized>
  <array members="3">
    <item name="0" type="int">
      <array members="4">
        <item name="user" type="string">
          <string len="9" value="user-name"/>
        </item>
        <item name="network" type="string">
          <array members="1">
            <item name="localip" type="string">
              <string len="7" value="1.2.3.4"/>
            </item>
          </array>
        </item>
        <item name="2" type="int">
          <string len="4" value="Zwei"/>
        </item>
        <item name="language" type="string">
          <string len="6" value="german"/>
        </item>
      </array>
    </item>
    <item name="1" type="int">
      <object class="stdClass" members="6">
        <property name="property" access="public">
          <string len="4" value="test"/>
        </property>
        <property name="float" access="public">
          <float value="1"/>
        </property>
        <property name="bool" access="public">
          <bool value="true"/>
        </property>
        <property name="null" access="public">
          <null/>
        </property>
        <property name="recursion" access="public">
          <recursion value="8"/>
        </property>
        <property name="recursionref" access="public">
          <recursion value="8"/>
        </property>
      </object>
    </item>
    <item name="2" type="int">
      <object class="Serialized\Dumper\testObjectChild" members="6">
        <property class="Serialized\Dumper\testObjectChild" name="ca" access="private">
          <string len="7" value="private"/>
        </property>
        <property name="cb" access="protected">
          <string len="9" value="protected"/>
        </property>
        <property name="cc" access="public">
          <string len="6" value="public"/>
        </property>
        <property class="Serialized\Dumper\testObjectParent" name="pa" access="private">
          <string len="15" value="private, parent"/>
        </property>
        <property name="pb" access="protected">
          <string len="17" value="protected, parent"/>
        </property>
        <property name="pc" access="public">
          <string len="14" value="public, parent"/>
        </property>
      </object>
    </item>
  </array>
</serialized>
