<?xml version="1.0"?>
<!--

    Serialized - PHP Library for Serialized Data

    Copyright (C) 2010-2011 Tom Klingenberg, some rights reserved

    This program is free software: you can redistribute it and/or modify
    it under the terms of the GNU Affero General Public License as
    published by the Free Software Foundation, either version 3 of the
    License, or (at your option) any later version.

    This program is distributed in the hope that it will be useful,
    but WITHOUT ANY WARRANTY; without even the implied warranty of
    MERCHANTABILITY or FITNESS FOR A PARTICULAR PURPOSE.  See the
    GNU Affero General Public License for more details.

    You should have received a copy of the GNU Affero General Public License
    along with this program in a file called COPYING. If not, see
    <http://www.gnu.org/licenses/> and please report back to the original
    author.

 	============

    This is a XML dump of a more complex serialized array created
    with Serialized and the XML Dumper.

    See serialized.dtd

-->
<!DOCTYPE serialized SYSTEM "serialized.dtd">
<serialized>
  <variables count="3">
    <var name="test">
      <int value="1"/>
    </var>
    <var name="more">
      <array members="2">
        <item name="0" type="int">
          <int value="56"/>
        </item>
        <item name="key" type="string">
          <int value="57"/>
        </item>
      </array>
    </var>
    <var name="again">
      <int value="2"/>
    </var>
  </variables>
</serialized>